<?xml version="1.0" encoding="UTF-8"?>
<?xml-stylesheet href="./../css/mrt_stalist_xml.css" type="text/css"?>
<!DOCTYPE mrt-stalist SYSTEM "./dtd/mrt_stalist.dtd">
<mrt-stalist>
	<group letter="Ａ">
		
	</group>
	<group letter="Ｂ">
		
	</group>
	<group letter="Ｃ">
		
	</group>
	<group letter="Ｄ">
		
	</group>
	<group letter="Ｅ">
		
	</group>
	<group letter="Ｆ">
		
	</group>
	<group letter="Ｇ">
		
	</group>
	<group letter="Ｈ">
		
	</group>
	<group letter="Ｉ">
		
	</group>
	<group letter="Ｊ">
		
	</group>
	<group letter="Ｋ">
		
	</group>
	<group letter="Ｌ">
		
	</group>
	<group letter="Ｍ">
		
	</group>
	<group letter="Ｎ">
		
	</group>
	<group letter="Ｏ">
		
	</group>
	<group letter="Ｐ">
		
	</group>
	<group letter="Ｑ">
		
	</group>
	<group letter="Ｒ">
		
	</group>
	<group letter="Ｓ">
		
	</group>
	<group letter="Ｔ">
		
	</group>
	<group letter="Ｕ">
		
	</group>
	<group letter="Ｖ">
		
	</group>
	<group letter="Ｗ">
		
	</group>
	<group letter="Ｘ">
		
	</group>
	<group letter="Ｙ">
		
	</group>
	<group letter="Ｚ">
		
	</group>
	<group letter="＊">
		
	</group>
</mrt-stalist>