<?xml version="1.0" encoding="UTF-8"?>
<?xml-stylesheet href="./../css/mrt_stalist_xml.css" type="text/css"?>
<!DOCTYPE mrt-stalist SYSTEM "./dtd/mrt_stalist.dtd">
<mrt-stalist>
	<group letter="ㄅ">
		
	</group>
	<group letter="ㄆ">
		
	</group>
	<group letter="ㄇ">
		
	</group>
	<group letter="ㄈ">
		
	</group>
	<group letter="ㄉ">
		
	</group>
	<group letter="ㄊ">
		
	</group>
	<group letter="ㄋ">
		
	</group>
	<group letter="ㄌ">
		
	</group>
	<group letter="ㄍ">
		
	</group>
	<group letter="ㄎ">
		
	</group>
	<group letter="ㄏ">
		
	</group>
	<group letter="ㄐ">
		
	</group>
	<group letter="ㄑ">
		
	</group>
	<group letter="ㄒ">
		
	</group>
	<group letter="ㄓ">
		
	</group>
	<group letter="ㄔ">
		
	</group>
	<group letter="ㄕ">
		
	</group>
	<group letter="ㄖ">
		
	</group>
	<group letter="ㄗ">
		
	</group>
	<group letter="ㄘ">
		
	</group>
	<group letter="ㄙ">
		
	</group>
	<group letter="ㄧ">
		
	</group>
	<group letter="ㄨ">
		
	</group>
	<group letter="ㄩ">
		
	</group>
	<group letter="ㄚ">
		
	</group>
	<group letter="ㄛ">
		
	</group>
	<group letter="ㄜ">
		
	</group>
	<group letter="ㄝ">
		
	</group>
	<group letter="ㄞ">
		
	</group>
	<group letter="ㄟ">
		
	</group>
	<group letter="ㄠ">
		
	</group>
	<group letter="ㄡ">
		
	</group>
	<group letter="ㄢ">
		
	</group>
	<group letter="ㄣ">
		
	</group>
	<group letter="ㄤ">
		
	</group>
	<group letter="ㄥ">
		
	</group>
	<group letter="ㄦ">
		
	</group>
	<group letter="＊">
		
	</group>
</mrt-stalist>